route_id,route_name,trigger_keywords,engineering_needs,performance_targets,verification_keywords,source_asset,data_status
R1,耐环境防护材料与表面工程材料,腐蚀、防腐、海洋、盐雾、湿热、涂层、表面处理、防护、耐介质,长期服役环境稳定性、耐湿热、耐腐蚀、表面防护,耐腐蚀性、耐湿热性、低吸水率、附着力、耐介质性,盐雾、湿热、腐蚀、电化学、附着力、表面分析、涂层,第一版 rules/material_route_rules.yaml,规则库数据，需结合真实产业记录人工审核
R2,轻量化结构材料与复合材料,轻量化、减重、结构件、船体、车辆、装备、复合材料、高强,结构减重、高承载、服役可靠性,高比强度、高比模量、耐疲劳、耐冲击、耐环境性,拉伸、弯曲、冲击、疲劳、密度、复合材料,第一版 rules/material_route_rules.yaml,规则库数据，需结合真实产业记录人工审核
R3,耐磨耐蚀表面材料,磨损、摩擦、冲蚀、表面强化、耐磨、机械寿命、硬度,摩擦磨损控制、服役寿命提升,耐磨性、硬度、耐冲蚀性、抗疲劳性,摩擦磨损、硬度、冲蚀、表面分析、显微组织,第一版 rules/material_route_rules.yaml,规则库数据，需结合真实产业记录人工审核
R4,高导热绝缘与热管理材料,导热、散热、热管理、热失控、电子、电池、功率器件、热稳定,热量传导、热安全、器件可靠性,导热系数、绝缘性、热稳定性、界面稳定性,导热、热分析、介电、绝缘、热循环,第一版 rules/material_route_rules.yaml,规则库数据，需结合真实产业记录人工审核
R5,电子封装与低介电材料,集成电路、芯片、封装、介电、低损耗、射频、电子信息,信号传输、电子封装、介电可靠性,低介电常数、低介电损耗、热稳定性、绝缘性、可靠性,介电、阻抗、热分析、封装、可靠性,第一版 rules/material_route_rules.yaml,规则库数据，需结合真实产业记录人工审核
R6,阻燃与热安全材料,阻燃、热失控、储能、电池、防火、抑烟、热安全,热安全、火灾风险控制、阻燃防护,阻燃性、热稳定性、抑烟性、机械完整性,阻燃、燃烧、热分析、烟密度、安全测试,第一版 rules/material_route_rules.yaml,规则库数据，需结合真实产业记录人工审核
R7,耐介质密封与阻隔材料,密封、防水、阻隔、渗透、化工、管道、介质、耐压,介质隔离、防渗漏、密封可靠性,低渗透率、耐介质性、耐湿热性、密封稳定性,渗透、密封、耐压、浸泡、耐介质,第一版 rules/material_route_rules.yaml,规则库数据，需结合真实产业记录人工审核
R8,绿色循环与低碳材料,再生、循环利用、低碳、绿色、固废、环保、资源化、可回收,资源循环、绿色制造、环境影响降低,可回收性、资源利用率、低碳性、环境稳定性,循环利用、碳足迹、再生、环保、生命周期,第一版 rules/material_route_rules.yaml,规则库数据，需结合真实产业记录人工审核
