step_id,step_name,objective,outputs,source_asset,data_status
RD-01,文献与专利精筛,明确候选路线已有研究、专利布局和技术空白。,检索式、关键文献清单、专利风险点、可复核证据,第一版 rules/rd_path_rules.yaml,研发流程规则，需按具体项目人工审核
RD-02,目标性能指标确认,将工程需求转化为可测试指标名称和验收口径，不生成预测数值。,指标名称、测试标准候选、应用工况边界、人工审核记录,第一版 rules/rd_path_rules.yaml,研发流程规则，需按具体项目人工审核
RD-03,候选体系初筛,基于路线级知识库选择候选材料体系，不输出配方。,候选体系清单、推荐理由、主要风险、专家审核意见,第一版 rules/rd_path_rules.yaml,研发流程规则，需按具体项目人工审核
RD-04,小试制备,在实验室条件下验证工艺可行性和样品稳定性。,小试方案、样品批次记录、工艺窗口记录,第一版 rules/rd_path_rules.yaml,研发流程规则，需按具体项目人工审核
RD-05,性能检测,围绕路线验证关键词开展检测，形成可追溯实验记录。,检测项目、检测记录、异常说明、数据回传表,第一版 rules/rd_path_rules.yaml,研发流程规则，需按具体项目人工审核
RD-06,结果回写和规则修订,将审核和实验结果回写平台，修订规则和候选体系知识库。,规则修订记录、审核状态更新、证据链归档,第一版 rules/rd_path_rules.yaml,研发流程规则，需按具体项目人工审核
